<?xml version="1.0" encoding="UTF-8" ?>

<digit_data xmlns:xsi="http://www.w3.org/2001/XMLSchema-instance"
	    xsi:noNamespaceSchemaLocation="schema/digit.xsd">
  
  <device id="0xff" name="null"/>
  <!--________________________________________________________________-->
  <device id="1" name="BHT" type="Hodo"><for var="seg" from="0" to="63">
    <segment id="seg"><for var="UorD" from="0" to="1">
      <ch id="UorD">
        <data id="0" name="leading"/>
        <data id="1" name="trailing"/>
	<data id="2" name="commonstop"/>
	<data id="3" name="overflow"/>
	<data id="4" name="adc"/>
      </ch></for>
    </segment></for>
  </device>
  <!--________________________________________________________________-->
  <device id="2" name="T0" type="Hodo"><for var="seg" from="0" to="4">
    <segment id="seg"><for var="UorD" from="0" to="2">
      <ch id="UorD">
        <data id="0" name="adc"/>
        <data id="1" name="leading"/>
        <data id="2" name="trailing"/>
	<data id="3" name="commonstop"/>
	<data id="4" name="overflow"/>
      </ch></for>
    </segment></for>
  </device>
  <!--________________________________________________________________-->
  <device id="3" name="BH2" type="Hodo"><for var="seg" from="0" to="14">
      <segment id="seg"><for var="UorD" from="0" to="2">
	  <ch id="UorD">
            <data id="0" name="adc"/>
            <data id="1" name="leading"/>
            <data id="2" name="trailing"/>
	    <data id="3" name="commonstop"/>
	    <data id="4" name="overflow"/>
	</ch></for>
    </segment></for>
  </device>
  <!--________________________________________________________________-->
  <device id="4" name="BAC" type="Hodo">
    <for var="seg" from="0" to="4">
      <segment id="seg">
        <ch id="0">
          <data id="0" name="adc"/>
          <data id="1" name="leading"/>
          <data id="2" name="trailing"/>
	  <data id="3" name="commonstop"/>
	  <data id="4" name="overflow"/>
        </ch>
    </segment></for>
  </device>
  <!--________________________________________________________________-->
  <device id="5" name="HTOF" type="Hodo"><for var="seg" from="0" to="33">
      <segment id="seg"><for var="UorD" from="0" to="2">
	  <ch id="UorD">
            <data id="0" name="adc"/>
            <data id="1" name="leading"/>
            <data id="2" name="trailing"/>
	    <data id="3" name="commonstop"/>
	    <data id="4" name="overflow"/>
	</ch></for>
    </segment></for>
  </device>
  <!--________________________________________________________________-->
  <device id="6" name="KVC" type="Hodo">
    <for var="seg" from="0" to="7">
      <segment id="seg"><for var="ch" from="0" to="4">
        <ch id="ch">
          <data id="0" name="adc"/>
          <data id="1" name="leading"/>
          <data id="2" name="trailing"/>
	  <data id="3" name="commonstop"/>
	  <data id="4" name="overflow"/>
        </ch></for>
    </segment></for>
  </device>
  <!--________________________________________________________________-->
  <device id="7" name="T1" type="Hodo"><for var="seg" from="0" to="0">
    <segment id="seg"><for var="UorD" from="0" to="1">
      <ch id="UorD">
        <data id="0" name="adc"/>
        <data id="1" name="leading"/>
        <data id="2" name="trailing"/>
	<data id="3" name="commonstop"/>
	<data id="4" name="overflow"/>
      </ch></for>
    </segment></for>
  </device>
  <!--________________________________________________________________-->
  <device id="8" name="CVC" type="Hodo"><for var="seg" from="0" to="7">
    <segment id="seg"><for var="UorD" from="0" to="2">
      <ch id="UorD">
        <data id="0" name="adc"/>
        <data id="1" name="leading"/>
        <data id="2" name="trailing"/>
	<data id="3" name="commonstop"/>
	<data id="4" name="overflow"/>
      </ch></for>
    </segment></for>
  </device>
  <!--________________________________________________________________-->
  <device id="9" name="SAC3" type="Hodo"><for var="seg" from="0" to="0">
      <segment id="seg"><for var="UorD" from="0" to="1">
	  <ch id="UorD">
            <data id="0" name="adc"/>
            <data id="1" name="leading"/>
            <data id="2" name="trailing"/>
	    <data id="3" name="commonstop"/>
	    <data id="4" name="overflow"/>
	</ch></for>
    </segment></for>
  </device>
  <!--________________________________________________________________-->
  <device id="10" name="SFV" type="Hodo"><for var="seg" from="0" to="4">
      <segment id="seg"><for var="UorD" from="0" to="1">
	  <ch id="UorD">
            <data id="0" name="adc"/>
            <data id="1" name="leading"/>
            <data id="2" name="trailing"/>
	    <data id="3" name="commonstop"/>
	    <data id="4" name="overflow"/>
	</ch></for>
    </segment></for>
  </device>
  <!--________________________________________________________________-->
  <device id="11" name="COBO"><for var="seg" from="0" to="15">
      <segment id="seg"><for var="UorD" from="0" to="0">
	  <ch id="UorD">
            <data id="0" name="adc"/>
            <data id="1" name="leading"/>
            <data id="2" name="trailing"/>
	    <data id="3" name="commonstop"/>
	    <data id="4" name="overflow"/>
	</ch></for>
    </segment></for>
  </device>

  <!--________________________________________________________________-->
  <device id="70" name="TPC">
    <for var="plane" from="0" to="31"><plane id="plane">
      <for var="ch" from="0" to="271">
	<ch id="ch">
	  <data id="0" name="adc"/>
	  <data id="1" name="tdc_high"/>
	  <data id="2" name="tdc_low"/>
	</ch>
      </for>
    </plane></for>
  </device>
  <!--________________________________________________________________-->
  <device id="170" name="TPCdummy">
    <for var="plane" from="0" to="31"><plane id="plane">
      <for var="ch" from="0" to="271">
	<ch id="ch">
	  <data id="0" name="adc"/>
	</ch>
      </for>
    </plane></for>
  </device>
  <!--________________________________________________________________-->
  <device id="81" name="VME-RM">
    <plane id="0" name="vme01">
      <ch id="0" name="tag">
	<data id="0" name="event"/>
	<data id="1" name="spill"/>
	<data id="2" name="serial"/>
	<data id="3" name="time"/>
      </ch>
      <ch id="1" name="lock_bit">
	<data id="0" name="event"/>
	<data id="1" name="spill"/>
	<data id="2" name="serial"/>
	<data id="3" name="time"/>
      </ch>
    </plane>
    <plane id="1" name="vme02">
      <ch id="0" name="tag">
	<data id="0" name="event"/>
	<data id="1" name="spill"/>
	<data id="2" name="serial"/>
	<data id="3" name="time"/>
      </ch>
      <ch id="1" name="lock_bit">
	<data id="0" name="event"/>
	<data id="1" name="spill"/>
	<data id="2" name="serial"/>
	<data id="3" name="time"/>
      </ch>
    </plane>
    <plane id="2" name="vme03">
      <ch id="0" name="tag">
	<data id="0" name="event"/>
	<data id="1" name="spill"/>
	<data id="2" name="serial"/>
	<data id="3" name="time"/>
      </ch>
      <ch id="1" name="lock_bit">
	<data id="0" name="event"/>
	<data id="1" name="spill"/>
	<data id="2" name="serial"/>
	<data id="3" name="time"/>
      </ch>
    </plane>
  </device>
  <!--________________________________________________________________-->
  <device id="82" name="HUL-RM"><for var="seg" from="0" to="15">
    <segment id="seg"><for var="UorD" from="0" to="1">
      <ch id="UorD">
        <data id="0" name="leading"/>
        <data id="1" name="trailing"/>
        <data id="2" name="hitnum"/>
	<data id="3" name="event"/>
	<data id="4" name="spill"/>
	<data id="5" name="sinc"/>
	<data id="6" name="lock"/>
      </ch></for>
    </segment></for>
  </device>
  <!--________________________________________________________________-->
  <device id="91" name="Scaler">
    <plane id="0">
      <for var="ch" from="0" to="63">
	<ch id="ch">
	  <data id="0" name="scaler"/>
	  <data id="1" name="event"/>
	  <data id="2" name="spill"/>
	  <data id="3" name="sinc"/>
	  <data id="4" name="lock"/>
	</ch>
      </for>
    </plane>
    <plane id="1">
      <for var="ch" from="0" to="63">
	<ch id="ch">
	  <data id="0" name="scaler"/>
	  <data id="1" name="event"/>
	  <data id="2" name="spill"/>
	  <data id="3" name="sinc"/>
	  <data id="4" name="lock"/>
	</ch>
      </for>
    </plane>
  </device>
  <!--________________________________________________________________-->
  <device id="99" name="TriggerFlag"><for var="seg" from="0" to="127">
    <segment id="seg">
      <data id="0" name="adc"/>
      <data id="1" name="leading"/>
      <data id="2" name="trailing"/>
      <data id="3" name="commonstop"/>
      <data id="4" name="overflow"/>
    </segment></for>
  </device>
  <!--________________________________________________________________-->
  <device id="101" name="BLC1a">
    <plane id="0" name="plane1"><for var="wire" from="0" to="31">
      <ch id="wire">
	<data id="0" name="leading"/>
	<data id="1" name="trailing"/>
	<data id="2" name="hitnum"/>
      </ch></for>
    </plane>
    <plane id="1" name="plane2"><for var="wire" from="0" to="31">
      <ch id="wire">
	<data id="0" name="leading"/>
	<data id="1" name="trailing"/>
	<data id="2" name="hitnum"/>
      </ch></for>
    </plane>
    <plane id="2" name="plane3"><for var="wire" from="0" to="31">
      <ch id="wire">
	<data id="0" name="leading"/>
	<data id="1" name="trailing"/>
	<data id="2" name="hitnum"/>
      </ch></for>
    </plane>
    <plane id="3" name="plane4"><for var="wire" from="0" to="31">
      <ch id="wire">
	<data id="0" name="leading"/>
	<data id="1" name="trailing"/>
	<data id="2" name="hitnum"/>
      </ch></for>
    </plane>
    <plane id="4" name="plane5"><for var="wire" from="0" to="31">
      <ch id="wire">
	<data id="0" name="leading"/>
	<data id="1" name="trailing"/>